Company Name,Funding Amount,Stage,Estimated ARR Stage,Why Contact Now,Date
Ressio,$8.8M,Series A,$1-5M ARR,"Recently raised funding, potential hiring needs","March 17, 2026"
Tagbin,$10M,Series A,$1-5M ARR,"Recently raised funding, potential expansion","March 17, 2026"
Fuse,$25M,Series B,$5-20M ARR,"Recently raised funding, potential hiring needs","March 17, 2026"
Candex,$40M,Series C,$20-50M ARR,Recently funded - likely entering active hiring phase.,"March 17, 2026"
Connecticut City,$50M,Series C,$20-50M ARR,Recently funded - likely entering active hiring phase.,"March 17, 2026"
DC startup Ressio,$8.8M,Series A,$1-5M ARR,Recently funded - likely entering active hiring phase.,"March 17, 2026"
New Orleans-based Civilized AI,$2M,Seed,$0-2M ARR,Recently funded - likely entering active hiring phase.,"March 17, 2026"
Swedish Legal Tech Startup Legora Triples Valuatio,$5.5B,Late Stage,$50M+ ARR,Recently funded - likely entering active hiring phase.,"March 17, 2026"
